{
  "identity": {
    "name": "Павел",
    "subject": "человек",
    "subject_kind": "living"
  },
  "body_profile": {
    "body_concept": "Молодой мужчина с гибким, собранным телом; поверх обычной одежды лежит тонкий полупрозрачный внешний слой с одним длинным мягким краем.",
    "silhouette": "Узкий человеческий силуэт разрезан длинным мягким хвостом полупрозрачного слоя: при любом рывке край заметно отстаёт и описывает широкую дугу.",
    "scale": "Павел крупнее обоих своих предметов: плоский футляр помещается в одной ладони, а камешек ещё меньше.",
    "front": "Лицо, грудь и раскрытые ладони.",
    "visible_parts": [
      "лицо с сосредоточенным, ровным выражением",
      "руки с длинными подвижными пальцами",
      "язык, чуть высунутый при точном движении",
      "тонкий полупрозрачный внешний слой",
      "длинный мягкий край этого слоя"
    ],
    "movement_contact": [
      "Левитирует у стекла без опоры на видимую поверхность.",
      "Тормозит дрейф коротким касанием ладони о стекло.",
      "При необходимости гасит вращение кратким касанием края локальной плоскости."
    ],
    "view_predisposition": {
      "mode": "front",
      "reason": "Фронтальный вид лучше всего показывает лицо, работу ладоней с камешком и длинный запаздывающий край внешнего слоя."
    }
  },
  "visual_signature": {
    "primary_silhouette_cue": "Длинный мягкий край полупрозрачного внешнего слоя тянется за узкой фигурой отдельной запоздалой дугой.",
    "secondary_readable_detail": "Плоский футляр с несколькими ячейками для малых деталей.",
    "body_language": "Почти неподвижно висит, бережно сводя ладони у груди, а затем внезапно делает точный короткий рывок и сразу собирается для коррекции дрейфа."
  },
  "passport": {
    "occupation": "Перекатывает любимый камешек и ставит маленькие опыты с его вращением рядом с открытым футляром.",
    "appearance": "Молодой мужчина с тонким полупрозрачным внешним слоем поверх одежды; его длинный мягкий край не сразу догоняет тело после движения.",
    "character": "Порывистый, но тихо-задумчивый и спокойный; то уходит в собственные наблюдения, то без напряжения раскрывается навстречу возможному собеседнику. Настроение держится ровно, а нелепые решения он выполняет с совершенно серьёзным лицом.",
    "motivation": "Играет ради самого приятного повторения жеста, не требуя от него результата.",
    "fear": "Боится неловким движением задеть и повредить важную для него собственную вещь.",
    "interests": [
      "Опыты с траекториями, вращением и отдачей небольших вещей.",
      "Любимые личные предметы и их мелкие детали."
    ],
    "goal": "Побыть рядом с любимым гладким камешком, перекатывая его и удерживая возле себя.",
    "habits": [
      "При особенно точном движении слегка высовывает язык.",
      "Во время раздумий непрерывно поворачивает маленькую вещь и тут же ловит её снова.",
      "Закончив один жест, сразу начинает следующий, не оставляя финальной паузы."
    ],
    "props": [
      "Плоский футляр с несколькими ячейками для малых собственных деталей.",
      "Гладкий разноцветный камешек любимой формы."
    ],
    "superpowers": [
      "Сверхэластичность тела.",
      "Чувство ритма."
    ],
    "power_manifestation": "Сверхэластичность крупно меняет форму рук и корпуса: Павел может вытянуть руку длинной петлёй, сплющить плечи или мягко закрутить торс и собрать его обратно. Чувство ритма заметно по тому, как его короткие движения, повороты камешка и коррекции тела безошибочно сходятся в повторяющийся рисунок; это не вращение предмета ради игры, а точный внутренний отсчёт телом."
  },
  "portrait": "Гладкий разноцветный камешек лежит между ладонями Павла, и он медленно прокатывает его от большого пальца к мизинцу, разглядывая знакомую форму так, словно в ней каждый раз находится новая грань. Рядом висит раскрытый плоский футляр с ячейками; Павел держит его близко, но не даёт камешку коснуться кромки. От точности движения у него чуть показывается язык.\n\nОн замирает, затем с совершенно серьёзным лицом готовит ладонь к широкому броску. Вместо этого вытягивает руку в длинную упругую петлю, обводит камешек вокруг себя и ловит его той же ладонью. Рывок уводит Павла вбок вдоль стекла; длинный мягкий край полупрозрачного слоя запаздывает за ним широкой дугой. Павел не меняет спокойного выражения, прижимает футляр к себе, чтобы не задеть его, коротко касается стекла свободной ладонью и гасит дрейф. Камешек уже снова поворачивается между пальцами: завершённого жеста он себе не оставляет.",
  "realization": {
    "gender.male": "Мужчина с мужским обликом и формами лица.",
    "age.21": "Молодое лицо и подвижное, ещё не тяжёлое телосложение.",
    "origin_world.living_emotions_world": "Родился в Обществе открытых эмоций; этот факт не меняет текущую сцену.",
    "character.energy.bursty": "После долгой неподвижности резко вытягивает руку и затем гасит полученный дрейф о стекло.",
    "character.sociality.ambivert": "Сосредоточенно работает с камешком наедине, но держит лицо открытым к внешней стороне стекла.",
    "character.emotional_tone.contemplative": "Подолгу рассматривает камешек и следит за малым поворотом в пальцах.",
    "character.emotional_tone.calm": "Даже во время коррекции дрейфа сохраняет ровное выражение лица.",
    "character.humor_style.deadpan": "Совершает явно нелепую петлю растянутой рукой без улыбки и подчёркивания.",
    "character.humor_style.visual_misdirection": "Явно готовит камешек к броску, а вместо этого обводит его вокруг себя и ловит.",
    "character.mood_dynamics.stable": "Спокойная сосредоточенность не меняется от рывка до торможения.",
    "inner_modifiers.motivation.play_for_its_own_sake": "Повторяет перекатывание и ловлю камешка без попытки закончить занятие.",
    "inner_modifiers.fear.harm_what_matters": "Во время дрейфа прижимает футляр ближе и не даёт камешку задеть его кромку.",
    "inner_modifiers.interest.movement_experiments": "Проверяет петлёй растянутой руки траекторию камешка и отдачу собственного движения.",
    "inner_modifiers.interest.favorite_objects": "Держит камешек и открытый футляр рядом, внимательно обращаясь с обоими.",
    "inner_modifiers.goal.enjoy_a_favorite_thing": "Ведущая сцена строится вокруг бережного перекатывания любимого камешка между ладонями.",
    "inner_modifiers.habit.stick_out_tongue_in_concentration": "Чуть высовывает язык, когда ловит камешек после точного оборота.",
    "inner_modifiers.habit.twirl_object_while_thinking": "Постоянно поворачивает камешек пальцами и ловит его без долгого отпускания.",
    "inner_modifiers.habit.refuse_a_final_pause": "Сразу после торможения снова начинает перекатывать камешек.",
    "external_modifiers.appearance_trait.trailing_soft_detail": "Длинный мягкий край внешнего слоя заметно отстаёт от его рывков.",
    "external_modifiers.appearance_trait.translucent_outer_layer": "Тонкий внешний слой поверх одежды частично прозрачен и читается отдельной поверхностью.",
    "external_modifiers.prop.sorting_case": "Открытый плоский футляр с ячейками висит рядом и удерживается в ладони.",
    "external_modifiers.prop.favorite_pebble": "Гладкий разноцветный камешек непрерывно перекатывается между пальцами.",
    "external_modifiers.superpower.elastic_body": "Рука растягивается в большую упругую петлю вокруг камешка и собирается обратно.",
    "external_modifiers.superpower.rhythm_sense": "Павел телом точно сводит поворот камешка, рывок и касание стекла в повторяющийся ритм.",
    "_scene_lead": "inner_modifiers.goal.enjoy_a_favorite_thing"
  }
}
