{
  "identity": {
    "name": "Аким",
    "subject": "человек",
    "subject_kind": "living"
  },
  "body_profile": {
    "body_concept": "Двадцатилетний мужчина с гибким, подвижным телом, тонкими пальцами и спокойным внимательным лицом.",
    "silhouette": "Вытянутый силуэт строится на свободной многослойной одежде: несколько мягких перекрывающихся пол и складок расходятся вокруг корпуса при повороте, а голова остаётся небольшой и собранной над ними.",
    "scale": "Аким заметно больше плоского футляра и маленькой книжечки-раскладушки; обе вещи удобно удерживаются одной или двумя руками.",
    "front": "лицо, грудь и раскрытые ладони",
    "visible_parts": [
      "лицо с мелкой крапинкой на коже",
      "тонкие пальцы",
      "многослойная свободная одежда",
      "гибкие руки и корпус"
    ],
    "movement_contact": [
      "прижимает ладонь к стеклу, чтобы погасить вращение или дрейф",
      "может провести пальцами вдоль края, удерживая себя в пределах плоскости"
    ],
    "view_predisposition": {
      "mode": "front",
      "reason": "Лицо, работа пальцев с футляром и книжечкой, а также растяжение рук лучше всего читаются через стекло спереди."
    }
  },
  "visual_signature": {
    "primary_silhouette_cue": "Свободная одежда собрана несколькими длинными мягкими слоями, которые при левитации расходятся вокруг узкого корпуса ступенчатым контуром.",
    "secondary_readable_detail": "Маленькая книжечка-раскладушка с узорами и картинками остаётся заметным личным предметом Акима.",
    "body_language": "Он висит с чуть поджатыми коленями, держит одну вещь в пределах касания и медленно рисует пальцем в воздухе будущую траекторию."
  },
  "passport": {
    "occupation": "Перекладывает малые детали в ячейках футляра и проверяет, как их траектории можно использовать для маленьких конструкций.",
    "appearance": "Молодой мужчина в свободной многослойной одежде; на открытой коже лица и кистей заметна россыпь мелких крапинок.",
    "character": "Неторопливый, спокойный и задумчивый экстраверт: он охотно обращает внимание к возможному присутствию за стеклом, но сохраняет ровное настроение. В подходящий момент повторяет один и тот же жест с нарастанием или готовится к очевидному действию, а завершает его безопасно иначе.",
    "motivation": "Ему важно, чтобы любимая книжечка-раскладушка оставалась в пределах касания.",
    "fear": "Боится неверно рассчитать траектории двух собственных вещей и увидеть их неминуемое столкновение.",
    "interests": [
      "Опыты с траекториями, вращением и отдачей небольших собственных предметов.",
      "Сборка миниатюрных конструкций из простых деталей, которые нужно точно совместить."
    ],
    "goal": "Ищет для обычной вещи неожиданное, но действительно работающее применение.",
    "habits": [
      "Смутившись, закрывает лицо ладонью или книжечкой.",
      "Озадачившись, чешет затылок.",
      "Во время размышления обводит пальцем в воздухе воображаемую форму."
    ],
    "props": [
      "Плоский футляр с несколькими ячейками для малых собственных деталей; открывается и закрывается одним движением.",
      "Маленькая книжечка-раскладушка с собственными узорами и картинками, которую приятно листать без чтения."
    ],
    "superpowers": [
      "Сверхэластичность: безопасно растягивает, сплющивает и закручивает существующие части тела на комиксно большую величину, после чего собирается обратно.",
      "Память формы: после одного взгляда помнит точный силуэт, узор и взаимное положение частей собственной вещи."
    ],
    "power_manifestation": "Сверхэластичность видна в длинных, сплющенных или закрученных руках и корпусе Акима, которые затем упруго собираются обратно. Память формы проявляется иначе: один раз осмотрев раскрытый футляр или узор книжечки, он без повторных примерок возвращает детали в точно запомненное взаимное положение, тогда как в обычном занятии медленно проверяет их траектории и совмещение."
  },
  "portrait": "Книжечка-раскладушка и раскрытый футляр сходятся слишком близко: оба после мягкого толчка плывут по прямым навстречу друг другу, а между ними уже остался один неловкий жест. Аким сначала тянется к футляру так, словно сейчас захлопнет его прямо на ходу, но в последний миг растягивает руку в широкую мягкую дугу. Ладонь принимает книжечку, не давая ей задеть ячейки, а другой рукой он бережно разворачивает футляр от её пути. От такого движения его самого медленно закручивает в обратную сторону; Аким без спешки прижимает свободную ладонь к стеклу и гасит вращение. Книжечка остаётся у запястья. Он чешет затылок, потом выводит пальцем в воздухе прямоугольник и раскрывает раскладушку рядом с ячейками: её сгибы вдруг годятся как точная мерка для маленькой конструкции. Несколько деталей встают по этим сгибам ровным рядом, и футляр закрывается одним спокойным движением.",
  "realization": {
    "_scene_lead": "inner_modifiers.fear.collide_own_things",
    "base_traits.gender.male": "Аким показан молодым мужчиной.",
    "base_traits.age.20": "Молодое лицо и телосложение соответствуют двадцатилетнему возрасту.",
    "base_traits.origin_world.steam_machine_city": "Нейтральный факт: Аким родился в городе паровых машин.",
    "base_traits.character.energy.unhurried": "Даёт вещам редкие мягкие импульсы и не суетится, когда гасит вращение ладонью о стекло.",
    "base_traits.character.sociality.extrovert": "Открыто держит лицо к стеклу и легко направляет внимание наружу.",
    "base_traits.character.emotional_tone.calm": "Даже при опасном сближении вещей действует ровно и без резких движений.",
    "base_traits.character.emotional_tone.contemplative": "Перед новой сборкой медленно обводит пальцем её форму в воздухе.",
    "base_traits.character.humor_style.repetition_escalation": "При проверке детали несколько раз повторяет короткий жест пальцем, каждый раз расширяя нарисованный в воздухе контур.",
    "base_traits.character.humor_style.visual_misdirection": "Кажется, что он сейчас захлопнет футляр, но вместо этого растягивает руку дугой и ловит книжечку.",
    "base_traits.character.mood_dynamics.stable": "Спокойное выражение и неторопливый темп не меняются после предотвращённого столкновения.",
    "inner_modifiers.motivation.keep_a_favorite_close": "Книжечка-раскладушка остаётся у его запястья, в пределах немедленного касания.",
    "inner_modifiers.fear.collide_own_things": "Он внимательно разводит траектории футляра и книжечки, не позволяя им столкнуться.",
    "inner_modifiers.interest.movement_experiments": "Следит за прямыми путями вещей после толчка и учитывает отдачу собственного движения.",
    "inner_modifiers.interest.miniature_construction": "Совмещает малые детали из ячеек в аккуратную миниатюрную форму.",
    "inner_modifiers.goal.invent_a_new_use": "Использует сгибы книжечки-раскладушки как мерку для выравнивания деталей.",
    "inner_modifiers.habit.hide_face_when_embarrassed": "После неловкого промаха может прикрыть лицо книжечкой.",
    "inner_modifiers.habit.scratch_head_when_puzzled": "Озадачившись траекториями, чешет затылок.",
    "inner_modifiers.habit.draw_idea_in_air": "Пальцем рисует в воздухе прямоугольник будущей конструкции.",
    "external_modifiers.appearance_trait.layered_silhouette": "Несколько мягких слоёв свободной одежды образуют читаемый ступенчатый контур вокруг корпуса.",
    "external_modifiers.appearance_trait.fine_speckling": "На коже лица и кистей видна мелкая россыпь контрастных крапинок.",
    "external_modifiers.prop.sorting_case": "Плоский футляр с ячейками раскрыт для деталей и закрывается одним движением.",
    "external_modifiers.prop.tiny_keepsake_book": "Маленькая книжечка-раскладушка с узорами остаётся рядом с рукой и служит меркой.",
    "external_modifiers.superpower.elastic_body": "Рука Акима комиксно вытягивается в широкую дугу, чтобы безопасно перехватить книжечку.",
    "external_modifiers.superpower.shape_recall": "После одного взгляда на ячейки он возвращает детали в запомненное взаимное положение без повторной примерки."
  }
}
